{
  "$schema": "https://json-schema.org/draft/2020-12/schema",
  "$id": "specrew://contracts/stack-aware-quality-bar/mechanical-findings/v1",
  "title": "Specrew Mechanical Findings v1",
  "type": "object",
  "additionalProperties": false,
  "required": [
    "schemaVersion",
    "featureRef",
    "iterationRef",
    "generatedAt",
    "generator",
    "findings"
  ],
  "properties": {
    "schemaVersion": {
      "type": "string",
      "const": "v1"
    },
    "featureRef": {
      "type": "string",
      "minLength": 1
    },
    "iterationRef": {
      "type": "string",
      "minLength": 1
    },
    "generatedAt": {
      "type": "string",
      "format": "date-time"
    },
    "generator": {
      "type": "object",
      "additionalProperties": false,
      "required": [
        "name",
        "version"
      ],
      "properties": {
        "name": {
          "type": "string",
          "minLength": 1
        },
        "version": {
          "type": "string",
          "minLength": 1
        }
      }
    },
    "findings": {
      "type": "array",
      "items": {
        "type": "object",
        "additionalProperties": false,
        "required": [
          "findingId",
          "gateId",
          "ruleId",
          "surfaceId",
          "severity",
          "message",
          "remediation",
          "source",
          "requirementRefs",
          "demoted"
        ],
        "properties": {
          "findingId": {
            "type": "string",
            "minLength": 1
          },
          "gateId": {
            "type": "string",
            "minLength": 1
          },
          "ruleId": {
            "type": "string",
            "minLength": 1
          },
          "surfaceId": {
            "type": "string",
            "minLength": 1
          },
          "severity": {
            "type": "string",
            "enum": [
              "error",
              "warning",
              "info"
            ]
          },
          "message": {
            "type": "string",
            "minLength": 1
          },
          "remediation": {
            "type": "string",
            "minLength": 1
          },
          "source": {
            "type": "object",
            "additionalProperties": false,
            "required": [
              "path",
              "line"
            ],
            "properties": {
              "path": {
                "type": "string",
                "minLength": 1
              },
              "line": {
                "type": "integer",
                "minimum": 1
              },
              "column": {
                "type": "integer",
                "minimum": 1
              }
            }
          },
          "requirementRefs": {
            "type": "array",
            "minItems": 1,
            "items": {
              "type": "string",
              "pattern": "^FR-[0-9]{3}[a-z]?$"
            }
          },
          "demoted": {
            "type": "boolean"
          },
          "dispositionRef": {
            "type": "string"
          }
        },
        "allOf": [
          {
            "if": {
              "properties": {
                "demoted": {
                  "const": true
                }
              }
            },
            "then": {
              "required": [
                "dispositionRef"
              ]
            }
          }
        ]
      }
    }
  }
}
