{
  "schemaVersion": "v1",
  "featureRef": "specs/051-multi-session-foundation/spec.md",
  "iterationRef": "specs/051-multi-session-foundation/iterations/003",
  "generatedAt": "2026-05-31T22:37:14Z",
  "generator": {
    "name": "specrew-mechanical-checks",
    "version": "0.29.0"
  },
  "findings": []
}