{
  "schemaVersion": "v1",
  "featureRef": "specs/049-pipeline-hardening-intake/spec.md",
  "iterationRef": "specs/049-pipeline-hardening-intake/iterations/004",
  "generatedAt": "2026-05-29T01:50:00Z",
  "generator": {
    "name": "specrew-iteration-scaffold",
    "version": "1.0.0"
  },
  "findings": []
}
