{
  "schemaVersion": "v1",
  "featureRef": "specs/177-software-development-rules-lens/spec.md",
  "iterationRef": "specs/177-software-development-rules-lens/iterations/002",
  "generatedAt": "2026-06-10T15:07:41Z",
  "generator": {
    "name": "specrew-mechanical-checks",
    "version": "0.35.0"
  },
  "findings": []
}
